{
  "$schema": "./config.schema.json",
  "resourceGroup": "rg-sentinel-optimizer-prod",
  "publicSiteUrl": "https://sentineloptimizer.com",
  "deployApi": false,
  "useApi": false,
  "staticWebAppName": "replace-with-unique-site-name",
  "functionAppName": "replace-with-unique-api-name",
  "oidc": {
    "infrastructureApplicationName": "sentinel-optimizer-infrastructure-github",
    "apiApplicationName": "sentinel-optimizer-api-github"
  },
  "openAi": {
    "accountName": "replace-with-unique-openai-name",
    "modelName": "gpt-4.1-mini",
    "deploymentName": "sentinel-optimizer-model"
  }
}
